{
  "$schema": "schemas/pricing-v1.schema.json",
  "id": "mistral-api-2026-09",
  "schema_version": 1,
  "kind": "api_usd",
  "agent": "other",
  "retrieved_at": "2026-10-07",
  "source_urls": [
    "https://docs.mistral.ai/inference/pricing",
    "https://docs.mistral.ai/models/model-cards/mistral-large-4-0",
    "https://docs.mistral.ai/models/overview"
  ],
  "source_ids": [
    "mistral-pricing-2026-09-23",
    "mistral-large-4-model-card-2026-10-07",
    "mistral-model-cards-2026-10-07",
    "openrouter-models-api-2026-10-07"
  ],
  "notes": "USD per 1M tokens. Standard direct API list rates. Mistral pricing page groups Large 3/Medium 3.5/Small 4 in flagship section; Large 3 is the current flagship model, Medium 3.5 is the current featured frontier-class model, and Small 4 is the low-cost open-weight candidate. 2026-10-07 re-verification: model cards re-read for Large 3 ($0.5 in / $1.5 out), Medium 3.5 ($1.5 / $7.5) and Small 4 ($0.15 / $0.6); input and output rates unchanged (cache-read rates on these rows were not shown on the cards and were not re-verified). ADDED mistral-large-4 (public preview, v26.10, 2026-10-06) at the card's ORIGINAL price $1.36 in / $0.14 cached / $4.18 out; the card simultaneously shows a SALE price of $0.68 / $0.07 / $2.09 with no end date, and OpenRouter lists $0.68 / $2.09. List price is stored because the sale has no stated validity window; AA's board also lists $1.36 / $4.18. Preview pricing may change at general availability. Context 1M per the card (OpenRouter lists 524,288).",
  "models": {
    "mistral-medium-3-5": {
      "fresh_input_per_m": 1.5,
      "cache_read_per_m": 0.15,
      "cache_write_per_m": 0,
      "output_per_m": 7.5,
      "confidence": "high"
    },
    "mistral-small-4": {
      "fresh_input_per_m": 0.15,
      "cache_read_per_m": 0.015,
      "cache_write_per_m": 0,
      "output_per_m": 0.6,
      "confidence": "high"
    },
    "mistral-large-3": {
      "fresh_input_per_m": 0.5,
      "cache_read_per_m": 0.05,
      "cache_write_per_m": 0,
      "output_per_m": 1.5,
      "confidence": "high"
    },
    "mistral-large-4": {
      "fresh_input_per_m": 1.36,
      "cache_read_per_m": 0.14,
      "cache_write_per_m": 0,
      "output_per_m": 4.18,
      "confidence": "high"
    }
  },
  "match": [
    {
      "pattern": "mistral-large-4",
      "model": "mistral-large-4"
    },
    {
      "pattern": "mistral-large-3",
      "model": "mistral-large-3"
    },
    {
      "pattern": "mistral-medium-3-5",
      "model": "mistral-medium-3-5"
    },
    {
      "pattern": "mistral-small-4",
      "model": "mistral-small-4"
    }
  ]
}
