{
  "$schema": "schemas/pricing-v1.schema.json",
  "schema_version": 1,
  "id": "zai-glm-api-2026-09",
  "kind": "api_usd",
  "agent": "other",
  "role": "operational",
  "retrieved_at": "2026-10-07",
  "source_ids": [
    "zai-glm-api-2026-09-05",
    "zai-pricing-2026-10-07",
    "zai-release-notes-2026-10-07",
    "zai-glm-5-3-flash-docs-2026-10-07"
  ],
  "source_urls": [
    "https://docs.z.ai/",
    "https://docs.z.ai/guides/overview/pricing",
    "https://docs.z.ai/release-notes/new-released"
  ],
  "notes": "Z.AI FIRST-PARTY direct API rates. This is a DIFFERENT price surface from Alibaba Model Studio, which resells GLM at its own regional/tier prices — the two must not be merged or averaged. GLM 5.1 was previously catalogued as third_party_board_only; Z.AI's own API docs establish it as a first-party model (200k context, 128k max output). 5.2 and 5.3 are current successors at the SAME published rates. Cache storage is temporarily free; web search is 0.01 USD per use — neither is expressible in this per-token schema. Thinking is a BINARY mode (thinking.type enabled|disabled), not a discrete effort ladder, so no effort-priced rows exist. 2026-10-07 re-verification of the first-party table: GLM-5.1, GLM-5.2 and GLM-5.3 still $1.4 / $0.26 / $4.4 (unchanged). ADDED glm-5.3-flash at $0.15 input / $0.03 cached / $0.50 output (first-party; the OpenRouter row for this model is a separate surface). GLM-5.3-FlashX (model code glm-5.3-flashx, 200 tokens/s) is priced at $0.37 / $0.075 / $1.25 but has no catalog model id (speed variant of Flash) and is not stored as a row. Z.AI release notes date GLM-5.3-Flash 2026-08-26.",
  "match": [
    {
      "pattern": "glm-5.3-flash",
      "model": "glm-5.3-flash"
    },
    {
      "pattern": "glm-5.1",
      "model": "glm-5.1"
    },
    {
      "pattern": "glm-5.2",
      "model": "glm-5.2"
    },
    {
      "pattern": "glm-5.3",
      "model": "glm-5.3"
    }
  ],
  "models": {
    "glm-5.1": {
      "fresh_input_per_m": 1.40,
      "cache_read_per_m": 0.26,
      "cache_write_per_m": 0,
      "output_per_m": 4.40,
      "confidence": "high",
      "valid_from": "2026-09-05"
    },
    "glm-5.2": {
      "fresh_input_per_m": 1.40,
      "cache_read_per_m": 0.26,
      "cache_write_per_m": 0,
      "output_per_m": 4.40,
      "confidence": "high",
      "valid_from": "2026-09-05"
    },
    "glm-5.3": {
      "fresh_input_per_m": 1.40,
      "cache_read_per_m": 0.26,
      "cache_write_per_m": 0,
      "output_per_m": 4.40,
      "confidence": "high",
      "valid_from": "2026-09-05"
    },
    "glm-5.3-flash": {
      "fresh_input_per_m": 0.15,
      "cache_read_per_m": 0.03,
      "cache_write_per_m": 0,
      "output_per_m": 0.50,
      "confidence": "high"
    }
  }
}
