{
  "$schema": "schemas/pricing-v1.schema.json",
  "id": "codex-credits-2026-07",
  "schema_version": 1,
  "kind": "codex_credits",
  "agent": "codex",
  "retrieved_at": "2026-10-07",
  "source_urls": [
    "https://developers.openai.com/codex/pricing",
    "https://learn.chatgpt.com/docs/pricing"
  ],
  "source_ids": [
    "openai-codex-pricing-2026-07-09",
    "openai-codex-pricing-2026-09-05",
    "openai-codex-pricing-2026-09-22",
    "openai-codex-pricing-2026-10-07"
  ],
  "notes": "Codex credits per 1M tokens (NOT USD). Verified 2026-07-09 against https://learn.chatgpt.com/docs/pricing rate card: Sol 250/25/1500, Terra 125/12.5/125, Luna 50/5/300, GPT-5.5 125/12.5/750, GPT-5.4 62.5/6.25/375, mini 18.75/1.875/113. Terra output 125 is intentional on the official card (not a transcription error). cache_write_per_m=0 means not separately billed (automatic caching), not free write. Quota windows on that page are plan limits — not interchangeable with credits or USD. 2026-09-05 refresh: added gpt-6-astra (250/25/1250). The 2026-07 rows for sol/terra/luna are RETAINED as-is but the vendor tier ladder has since shifted — current docs list sol 100/10/500 (promotional, at least through 2026-11-21; recorded as gpt-5.6-sol-promo per the claude-sonnet-5-intro precedent), terra 50/5/300 and luna 5/0.5/30. Terra/luna rows are therefore STALE and are left unmodified rather than silently rewritten; refresh them against the rate card in the next pricing pass. Fast mode applies a 2.5x multiplier to Astra Standard. Whether reasoning effort changes the per-token RATE (as opposed to token volume) is NOT stated by the vendor and is not assumed here. RATE REFRESH 2026-09-05 (vendor: learn.chatgpt.com/docs/pricing): all three GPT-5.6 rows CHANGED — sol 250/25/1500 -> 100/10/500 (vendor states promotional \"at least through November 21, 2026\", recorded as valid_until), terra 125/12.5/125 -> 50/5/300, luna 50/5/300 -> 5/0.5/30. The superseded values are retained verbatim as *-2026-07 rows with valid_from/valid_until so historical evidence is preserved without an obsolete row masquerading as current. gpt-5.5 / gpt-5.4 / gpt-5.4-mini re-verified UNCHANGED against the same page. Vendor page also lists Daybreak Blue (100/10/500), Daybreak Red (312.5/31.25/1875) and GPT-Image-2 rows which are NOT represented in this pack. 2026-09-22 addition: NEW gpt-6-sol (50/5/250) and gpt-6-luna (2.5/0.25/12.5) from the same rate card. gpt-6-astra (250/25/1250) and all three current GPT-5.6 rows (sol 100/10/500, terra 50/5/300, luna 5/0.5/30) re-verified UNCHANGED on this date — no Codex credit rate for any existing model changed today. Footnote reconfirmed: 'Fast mode uses 2.5x the Standard credit rate for GPT-6 Astra, Sol, and Luna where available.' 2026-10-07 refresh (direct curl of developers.openai.com/codex/pricing, rate-card table parsed; the page served full HTML this time): ADDED gpt-6.1-sol 50 / 2.5 / 250 credits per 1M tokens (input / cached input / output) - input and output equal GPT-6 Sol, cached input is half of GPT-6 Sol's 5. Re-verified UNCHANGED: gpt-6-astra 250/25/1250, gpt-6-sol 50/5/250, gpt-6-luna 2.5/0.25/12.5, gpt-5.6-sol 100/10/500, gpt-5.6-terra 50/5/300, gpt-5.6-luna 5/0.5/30, gpt-5.5 125/12.5/750. gpt-5.4 and gpt-5.4-mini are no longer on the rate card and were NOT re-verified (rows retained; gpt-5.4 and gpt-5.4-mini retired from Codex with ChatGPT sign-in on 2026-08-31 per the Codex models page). Speed footnote: Fast mode is 2x the Standard credit rate for purchased credits and Enterprise pay-as-you-go (2.5x for included subscription usage); GPT-6 Astra Ultrafast is 6x (8x included usage). Plan usage per 5 hours (Plus, local messages): Astra 5-45, GPT-6.1 Sol 15-160, GPT-6 Sol 15-150, GPT-6 Luna 350-3,000 - plan limits, not interchangeable with credits or USD.",
  "models": {
    "gpt-6-sol": {
      "fresh_input_per_m": 50,
      "cache_read_per_m": 5,
      "cache_write_per_m": 0,
      "output_per_m": 250,
      "confidence": "high",
      "valid_from": "2026-09-22"
    },
    "gpt-6-luna": {
      "fresh_input_per_m": 2.5,
      "cache_read_per_m": 0.25,
      "cache_write_per_m": 0,
      "output_per_m": 12.5,
      "confidence": "high",
      "valid_from": "2026-09-22"
    },
    "gpt-5.6-sol": {
      "fresh_input_per_m": 100,
      "cache_read_per_m": 10,
      "cache_write_per_m": 0,
      "output_per_m": 500,
      "confidence": "high",
      "valid_from": "2026-09-05",
      "valid_until": "2026-11-21"
    },
    "gpt-5.6-terra": {
      "fresh_input_per_m": 50,
      "cache_read_per_m": 5,
      "cache_write_per_m": 0,
      "output_per_m": 300,
      "confidence": "high",
      "valid_from": "2026-09-05"
    },
    "gpt-5.6-luna": {
      "fresh_input_per_m": 5,
      "cache_read_per_m": 0.5,
      "cache_write_per_m": 0,
      "output_per_m": 30,
      "confidence": "high",
      "valid_from": "2026-09-05"
    },
    "gpt-5.5": {
      "fresh_input_per_m": 125,
      "cache_read_per_m": 12.5,
      "cache_write_per_m": 0,
      "output_per_m": 750,
      "confidence": "high"
    },
    "gpt-5.4": {
      "fresh_input_per_m": 62.5,
      "cache_read_per_m": 6.25,
      "cache_write_per_m": 0,
      "output_per_m": 375,
      "confidence": "high"
    },
    "gpt-5.4-mini": {
      "fresh_input_per_m": 18.75,
      "cache_read_per_m": 1.875,
      "cache_write_per_m": 0,
      "output_per_m": 113,
      "confidence": "high"
    },
    "gpt-6-astra": {
      "fresh_input_per_m": 250,
      "cache_read_per_m": 25,
      "cache_write_per_m": 0,
      "output_per_m": 1250,
      "confidence": "high",
      "valid_from": "2026-09-05"
    },
    "gpt-5.6-sol-2026-07": {
      "fresh_input_per_m": 250,
      "cache_read_per_m": 25,
      "cache_write_per_m": 0,
      "output_per_m": 1500,
      "confidence": "high",
      "valid_from": "2026-07-09",
      "valid_until": "2026-09-05"
    },
    "gpt-5.6-terra-2026-07": {
      "fresh_input_per_m": 125,
      "cache_read_per_m": 12.5,
      "cache_write_per_m": 0,
      "output_per_m": 125,
      "confidence": "high",
      "valid_from": "2026-07-09",
      "valid_until": "2026-09-05"
    },
    "gpt-5.6-luna-2026-07": {
      "fresh_input_per_m": 50,
      "cache_read_per_m": 5,
      "cache_write_per_m": 0,
      "output_per_m": 300,
      "confidence": "high",
      "valid_from": "2026-07-09",
      "valid_until": "2026-09-05"
    },
    "gpt-6.1-sol": {
      "fresh_input_per_m": 50,
      "cache_read_per_m": 2.5,
      "cache_write_per_m": 0,
      "output_per_m": 250,
      "confidence": "high",
      "valid_from": "2026-09-29"
    }
  },
  "match": [
    {
      "pattern": "gpt-6-astra",
      "model": "gpt-6-astra"
    },
    {
      "pattern": "gpt-6.1-sol",
      "model": "gpt-6.1-sol"
    },
    {
      "pattern": "gpt-6-sol",
      "model": "gpt-6-sol"
    },
    {
      "pattern": "gpt-6-luna",
      "model": "gpt-6-luna"
    },
    {
      "pattern": "gpt-5.6-sol",
      "model": "gpt-5.6-sol"
    },
    {
      "pattern": "gpt-5.6-terra",
      "model": "gpt-5.6-terra"
    },
    {
      "pattern": "gpt-5.6-luna",
      "model": "gpt-5.6-luna"
    },
    {
      "pattern": "gpt-5.6",
      "model": "gpt-5.6-sol",
      "family_default": true
    },
    {
      "pattern": "gpt-5.5",
      "model": "gpt-5.5",
      "family_default": true
    },
    {
      "pattern": "gpt-5.4-mini",
      "model": "gpt-5.4-mini"
    },
    {
      "pattern": "gpt-5.4",
      "model": "gpt-5.4",
      "family_default": true
    }
  ],
  "role": "operational"
}
