{
  "$schema": "schemas/pricing-v1.schema.json",
  "id": "google-api-2026-07",
  "schema_version": 1,
  "kind": "api_usd",
  "agent": "google",
  "retrieved_at": "2026-10-07",
  "source_urls": [
    "https://ai.google.dev/gemini-api/docs/pricing",
    "https://ai.google.dev/gemini-api/docs/changelog",
    "https://blog.google/innovation-and-ai/models-and-research/gemini-models/gemini-4-argon/"
  ],
  "source_ids": [
    "google-gemini-models-2026-09-05",
    "google-gemini-pricing-2026-07-09",
    "google-gemini-pricing-2026-09-05",
    "google-gemini-pricing-2026-09-23",
    "google-gemini-models-2026-09-23",
    "google-gemini-pricing-2026-10-07",
    "google-gemini-changelog-2026-10-07",
    "google-gemini-4-argon-announcement-2026-09-30"
  ],
  "notes": "Standard paid tier USD/1MTok for prompts ≤200k where tiered. Long-context higher rates on source page not separate model ids. cache_write_per_m=0 (storage billed hourly, not write multiplier). Batch/Flex often ~50% off — not modeled here. role=reference: priced for lookup only; no waspflow provider and no policy ops. Do not treat as integrated. 2026-09-05 audit (delegated researcher, primary source ai.google.dev): all existing rows re-verified UNCHANGED — gemini-3.1-pro-preview, 3.5-flash, 3-flash-preview, 3.1-flash-lite, 2.5-pro, 2.5-flash, 2.5-flash-lite. NOT APPLIED, needs direct verification before entry: (a) a >200k-token tier for gemini-3.1-pro-preview (4.00/18.00) and gemini-2.5-pro (2.50/15.00) which this flat-rate schema does not model; (b) new Flash models 3.6/3.7/3.8-flash and 3.5-flash-lite reported promo-priced through 2026-12-31; (c) the researcher flagged as surprising that no Pro model newer than 3.1-pro-preview was found while the Flash line advanced to 3.8 — treat as unconfirmed until re-checked. 2026-09-05: ADDED four current models missing from this file — gemini-3.8-flash (2026-09-02), 3.7-flash (2026-08-13), 3.6-flash (2026-07-21) all at the INTRO rate 0.75/3.75 with valid_until 2026-12-31 (they rise to 1.50/7.50 on 2027-01-01, now recorded in post_valid_until); and gemini-3.5-flash-lite at 0.30/2.50. Output prices INCLUDE thinking tokens. NOT MODELED, documented rather than guessed: Batch/Flex/Priority service classes; cache STORAGE at 0.50/MTok-hour (intro) which is a per-hour charge this schema has no field for; and the >200k tier for gemini-3.1-pro-preview (4.00/18.00) and gemini-2.5-pro (2.50/15.00) — the existing flat rows for those two are the <=200k tier ONLY. ROSTER FLAG: gemini-3-pro is not on Google's current text roster; the live page lists gemini-3-pro-image, a separate image model. Left in place pending verification of its original source rather than renamed. 2026-09-23 primary-page recheck: all existing prices retained; Gemini 3.8 Flash remains $0.75/$3.75 per 1M input/output through 2026-12-31 and $1.50/$7.50 from 2027-01-01; Gemini 3.1 Pro is still preview. No price changes were made. 2026-10-07 re-verification of the paid-tier tables (direct curl, tables parsed): gemini-3.8/3.7/3.6-flash $0.75 / $3.75 / $0.075 through 2026-12-31 then $1.50 / $7.50 / $0.15; 3.5-flash $1.50 / $9.00 / $0.15; 3.5-flash-lite $0.30 / $2.50 / $0.03; 3.1-flash-lite $0.25 / $1.50 / $0.025; 3-flash-preview $0.50 / $3.00 / $0.05; 3.1-pro-preview $2.00 / $12.00 / $0.20 (<=200k); 2.5-pro $1.25 / $10.00 / $0.125; 2.5-flash $0.30 / $2.50 / $0.03; 2.5-flash-lite $0.10 / $0.40 / $0.01 - all unchanged. Gemini 4 Argon has NO row on the pricing page or in the changelog (announced 2026-09-30 for trusted cyber defenders only; the announcement states an introductory $2 / $10 per 1M tokens then $4 / $20, which is a vendor statement, not a published API rate) and is not added. Google limited access to the Gemini 2.5 models to existing users on 2026-09-18; they are not deprecated.",
  "models": {
    "gemini-3.1-pro-preview": {
      "fresh_input_per_m": 2.0,
      "cache_read_per_m": 0.2,
      "cache_write_per_m": 0,
      "output_per_m": 12.0
    },
    "gemini-3.5-flash": {
      "fresh_input_per_m": 1.5,
      "cache_read_per_m": 0.15,
      "cache_write_per_m": 0,
      "output_per_m": 9.0
    },
    "gemini-3-flash-preview": {
      "fresh_input_per_m": 0.5,
      "cache_read_per_m": 0.05,
      "cache_write_per_m": 0,
      "output_per_m": 3.0
    },
    "gemini-3.1-flash-lite": {
      "fresh_input_per_m": 0.25,
      "cache_read_per_m": 0.025,
      "cache_write_per_m": 0,
      "output_per_m": 1.5
    },
    "gemini-2.5-pro": {
      "fresh_input_per_m": 1.25,
      "cache_read_per_m": 0.125,
      "cache_write_per_m": 0,
      "output_per_m": 10.0
    },
    "gemini-2.5-flash": {
      "fresh_input_per_m": 0.3,
      "cache_read_per_m": 0.03,
      "cache_write_per_m": 0,
      "output_per_m": 2.5
    },
    "gemini-2.5-flash-lite": {
      "fresh_input_per_m": 0.1,
      "cache_read_per_m": 0.01,
      "cache_write_per_m": 0,
      "output_per_m": 0.4
    },
    "gemini-3.8-flash": {
      "fresh_input_per_m": 0.75,
      "cache_read_per_m": 0.075,
      "cache_write_per_m": 0,
      "output_per_m": 3.75,
      "confidence": "high",
      "valid_from": "2026-09-05",
      "valid_until": "2026-12-31",
      "post_valid_until": {
        "fresh_input_per_m": 1.5,
        "cache_read_per_m": 0.15,
        "cache_write_per_m": 0,
        "output_per_m": 7.5
      }
    },
    "gemini-3.7-flash": {
      "fresh_input_per_m": 0.75,
      "cache_read_per_m": 0.075,
      "cache_write_per_m": 0,
      "output_per_m": 3.75,
      "confidence": "high",
      "valid_from": "2026-09-05",
      "valid_until": "2026-12-31",
      "post_valid_until": {
        "fresh_input_per_m": 1.5,
        "cache_read_per_m": 0.15,
        "cache_write_per_m": 0,
        "output_per_m": 7.5
      }
    },
    "gemini-3.6-flash": {
      "fresh_input_per_m": 0.75,
      "cache_read_per_m": 0.075,
      "cache_write_per_m": 0,
      "output_per_m": 3.75,
      "confidence": "high",
      "valid_from": "2026-09-05",
      "valid_until": "2026-12-31",
      "post_valid_until": {
        "fresh_input_per_m": 1.5,
        "cache_read_per_m": 0.15,
        "cache_write_per_m": 0,
        "output_per_m": 7.5
      }
    },
    "gemini-3.5-flash-lite": {
      "fresh_input_per_m": 0.3,
      "cache_read_per_m": 0.03,
      "cache_write_per_m": 0,
      "output_per_m": 2.5,
      "confidence": "high",
      "valid_from": "2026-09-05"
    }
  },
  "match": [
    {
      "pattern": "gemini-3.1-pro",
      "model": "gemini-3.1-pro-preview"
    },
    {
      "pattern": "gemini-3.5-flash-lite",
      "model": "gemini-3.5-flash-lite"
    },
    {
      "pattern": "gemini-3.5-flash",
      "model": "gemini-3.5-flash"
    },
    {
      "pattern": "gemini-3-flash",
      "model": "gemini-3-flash-preview"
    },
    {
      "pattern": "gemini-3.1-flash-lite",
      "model": "gemini-3.1-flash-lite"
    },
    {
      "pattern": "gemini-2.5-pro",
      "model": "gemini-2.5-pro"
    },
    {
      "pattern": "gemini-2.5-flash-lite",
      "model": "gemini-2.5-flash-lite"
    },
    {
      "pattern": "gemini-2.5-flash",
      "model": "gemini-2.5-flash"
    },
    {
      "pattern": "gemini-3.8-flash",
      "model": "gemini-3.8-flash"
    },
    {
      "pattern": "gemini-3.7-flash",
      "model": "gemini-3.7-flash"
    },
    {
      "pattern": "gemini-3.6-flash",
      "model": "gemini-3.6-flash"
    },
    {
      "pattern": "gemini",
      "model": "gemini-3.1-pro-preview",
      "family_default": true
    }
  ],
  "role": "reference"
}
