{
  "$schema": "schemas/pricing-v1.schema.json",
  "id": "xai-api-2026-07",
  "schema_version": 1,
  "kind": "api_usd",
  "agent": "grok",
  "retrieved_at": "2026-10-07",
  "source_urls": [
    "https://docs.x.ai/developers/models",
    "https://docs.x.ai/developers/models/grok-4.7",
    "https://docs.x.ai/docs/models",
    "https://docs.x.ai/docs/release-notes"
  ],
  "source_ids": [
    "xai-grok-4-6-detail-2026-09-05",
    "xai-models-2026-07-09",
    "xai-models-2026-09-05",
    "xai-grok-4-7-2026-09-23",
    "xai-release-notes-2026-09-23",
    "xai-models-page-2026-10-07",
    "xai-release-notes-2026-10-07",
    "xai-grok-4-7-model-page-2026-10-07"
  ],
  "notes": "Chat/Code API USD per 1M tokens. cache_read/write not published as separate lines — set 0. Imagine/voice SKUs are non-token and omitted from models{} (see SOURCES notes). 2026-09-05 refresh: NEW grok-4.6 (released 2026-08-12, after this file's original retrieval) at 2.00 in / 0.50 cached / 6.00 out, 500k context — xAI describes it as \"the most intelligent and fastest model\". CORRECTED: every model previously carried cache_read_per_m=0, but docs.x.ai publishes real cached-input rates (0.20-0.50); base input/output rates re-verified UNCHANGED for all pre-existing models. NOT MODELED (documented, deliberately out of scope for this flat-rate schema): a >=200k-token tier that doubles input and output for every xAI model. 2026-09-05: grok-4.6 long-context tier VERIFIED at >=200k: 4.00 in / 1.00 cached / 12.00 out (the stored flat row is the <200k tier). Primary evidence proves this for 4.6 ONLY — the earlier blanket note claiming the tier applies to every xAI model is not established per-model and should not be generalized until each model page is checked. grok-4.5/4.3/4.20-*/build-0.1 are absent from the current models page; their rows are RETAINED because absence from a list does not prove runtime retirement. 2026-09-23: added grok-4.7 from the current first-party detail page: 2.00 input / 0.50 cached input / 6.00 output under 200k; the page separately documents 4.00 / 1.00 / 12.00 above 200k. This flat schema stores the under-200k tier only. Fast is excluded because it has no public API model id. 2026-10-07 re-verification: models page (last updated 2026-09-21) lists grok-4.7 only, $2.00 in / $6.00 out, and the grok-4.7 model page shows $0.50 cached input; release notes (last updated 2026-10-02) show no new text model or price change. The older Grok rows (4.6, 4.5, 4.3, 4.20-*, build-0.1) are still absent from the models page and were not re-verified; they are retained.",
  "models": {
    "grok-4.5": {
      "fresh_input_per_m": 2.0,
      "cache_read_per_m": 0.30,
      "cache_write_per_m": 0,
      "output_per_m": 6.0
    },
    "grok-4.3": {
      "fresh_input_per_m": 1.25,
      "cache_read_per_m": 0.20,
      "cache_write_per_m": 0,
      "output_per_m": 2.5
    },
    "grok-4.20-0309-reasoning": {
      "fresh_input_per_m": 1.25,
      "cache_read_per_m": 0.20,
      "cache_write_per_m": 0,
      "output_per_m": 2.5
    },
    "grok-4.20-0309-non-reasoning": {
      "fresh_input_per_m": 1.25,
      "cache_read_per_m": 0.20,
      "cache_write_per_m": 0,
      "output_per_m": 2.5
    },
    "grok-4.20-multi-agent-0309": {
      "fresh_input_per_m": 1.25,
      "cache_read_per_m": 0.20,
      "cache_write_per_m": 0,
      "output_per_m": 2.5
    },
    "grok-build-0.1": {
      "fresh_input_per_m": 1.0,
      "cache_read_per_m": 0.20,
      "cache_write_per_m": 0,
      "output_per_m": 2.0
    },
    "grok-4.6": {
      "fresh_input_per_m": 2.0,
      "cache_read_per_m": 0.5,
      "cache_write_per_m": 0,
      "output_per_m": 6.0
    },
    "grok-4.7": {
      "fresh_input_per_m": 2.0,
      "cache_read_per_m": 0.50,
      "cache_write_per_m": 0,
      "output_per_m": 6.0
    }
  },
  "match": [
    {
      "pattern": "grok-4.7",
      "model": "grok-4.7"
    },
    {
      "pattern": "grok-4.5",
      "model": "grok-4.5"
    },
    {
      "pattern": "grok-4.3",
      "model": "grok-4.3"
    },
    {
      "pattern": "4.20-multi-agent",
      "model": "grok-4.20-multi-agent-0309"
    },
    {
      "pattern": "4.20-0309-reasoning",
      "model": "grok-4.20-0309-reasoning"
    },
    {
      "pattern": "4.20-0309-non",
      "model": "grok-4.20-0309-non-reasoning"
    },
    {
      "pattern": "grok-build",
      "model": "grok-build-0.1"
    },
    {
      "pattern": "grok",
      "model": "grok-4.6",
      "family_default": true
    },
    {
      "pattern": "grok-4.6",
      "model": "grok-4.6"
    }
  ],
  "role": "operational"
}
